{
  "id": "EV-0514",
  "trecho": "TR-0514",
  "proposicao": "PR-0421",
  "sentido": "a favor",
  "voz": {
    "tipo": "autor",
    "papel": "equipe do dossiê de registro"
  },
  "lugares": {
    "pratica": "LU-0023",
    "publicacao": "LU-0032",
    "pesquisa": "LU-0033"
  },
  "estado": "não conferida",
  "sustenta_aviso_saude_politica": false,
  "protecao": {
    "licenca": "não conferido",
    "consentimento": "não se aplica",
    "restricao_comunitaria": "nenhuma conhecida",
    "precisao_lugar": "não se aplica",
    "dado_sensivel": false,
    "crianca_ou_adolescente": false,
    "pedido_de_retirada": "nenhum"
  },
  "origem_registro": {
    "criado_por": "scripts/gravar_extracao.py (gravar-extracao-0.2)",
    "data": "2026-10-29",
    "execucao": "EX-0069"
  },
  "criterio_pratica_cultural": "identidade ou memória"
}
