{
  "id": "EV-900001",
  "trecho": "TR-900099",
  "proposicao": "PR-900001",
  "sentido": "a favor",
  "voz": {
    "tipo": "autor"
  },
  "lugares": {
    "pratica": "LU-900001",
    "publicacao": "LU-900001",
    "pesquisa": "LU-900001"
  },
  "estado": "conferida",
  "protecao": {
    "licenca": "não conferido",
    "consentimento": "não se aplica",
    "restricao_comunitaria": "nenhuma conhecida",
    "precisao_lugar": "UF",
    "dado_sensivel": false,
    "crianca_ou_adolescente": false,
    "pedido_de_retirada": "nenhum"
  },
  "origem_registro": {
    "criado_por": "curador (exemplo de esquema, K-105)",
    "data": "2026-10-22",
    "execucao": "EX-900001"
  },
  "nota": "exemplo de esquema (K-105): dado sintético"
}
