{
  "id": "EV-0060",
  "trecho": "TR-0060",
  "proposicao": "PR-0042",
  "sentido": "a favor",
  "voz": {
    "tipo": "autor",
    "papel": "autores da publicação (Embrapa)"
  },
  "lugares": {
    "pratica": "F-0021",
    "publicacao": "F-0023",
    "pesquisa": "F-0022"
  },
  "estado": "não conferida",
  "sustenta_aviso_saude_politica": false,
  "protecao": {
    "licenca": "não conferido",
    "consentimento": "não se aplica",
    "restricao_comunitaria": "nenhuma conhecida",
    "precisao_lugar": "não se aplica",
    "dado_sensivel": false,
    "crianca_ou_adolescente": false,
    "pedido_de_retirada": "nenhum"
  },
  "origem_registro": {
    "criado_por": "scripts/gravar_extracao.py (gravar-extracao-0.1)",
    "data": "2026-10-29",
    "execucao": "EX-0050"
  }
}
