{
  "id": "EV-0074",
  "trecho": "TR-0074",
  "proposicao": "PR-0056",
  "sentido": "a favor",
  "voz": {
    "tipo": "instituição",
    "papel": "página do BCR/Iphan (síntese feita com auxílio de IA e revisada por especialistas, segundo a página)"
  },
  "lugares": {
    "pratica": "LU-0023",
    "publicacao": "LU-0004",
    "pesquisa": "LU-0024"
  },
  "estado": "não conferida",
  "sustenta_aviso_saude_politica": false,
  "protecao": {
    "licenca": "não conferido",
    "consentimento": "não se aplica",
    "restricao_comunitaria": "nenhuma conhecida",
    "precisao_lugar": "não se aplica",
    "dado_sensivel": false,
    "crianca_ou_adolescente": false,
    "pedido_de_retirada": "nenhum"
  },
  "origem_registro": {
    "criado_por": "scripts/gravar_extracao.py (gravar-extracao-0.2)",
    "data": "2026-10-29",
    "execucao": "EX-0065"
  },
  "criterio_pratica_cultural": "reconhecimento pelo grupo"
}
